{
  "$schema": "https://json-schema.org/draft/2020-12/schema",
  "title": "Eval Case",
  "type": "object",
  "required": [
    "scenarioId",
    "request",
    "expectations"
  ],
  "properties": {
    "scenarioId": {
      "type": "string"
    },
    "description": {
      "type": "string"
    },
    "request": {
      "type": "object"
    },
    "expectations": {
      "type": "object"
    },
    "budgets": {
      "type": "object"
    }
  }
}